{
  "$schema": "../../.ai/schemas/generation-receipt.schema.json",
  "schemaVersion": 1,
  "runId": "01M0QV63AMB9BHFPE6QMAY5XG1",
  "status": "succeeded",
  "startedAtUtc": "2026-08-23T17:37:38.6442877\u002B00:00",
  "finishedAtUtc": "2026-08-23T17:38:22.4488076\u002B00:00",
  "actorId": "codex-imagegen-service",
  "assetId": "MKT-RIFTWARD-RESEARCH-HERO-001",
  "generationBindingMode": "canonical-event-v1",
  "eventCount": 3,
  "events": [{"sequence":1,"timestampUtc":"2026-08-23T17:37:38.6442877\u002B00:00","type":"run.started","previousEventHash":null,"payload":{"provenance":{"complete":{"config":true,"git":false,"model":true,"prompt":true,"task":false,"toolchain":true},"configSha256":"c2c07b5bc1d089f912afe40644c0f521c0760273cd03e94cbb9dc8ac3295f043","gitCommit":null,"modelId":"OpenAI built-in image generation","promptSha256":"50ce178f6d61f4dc5fad0ac89dd81936802313428e05e77aa338c3a53013682f","schemaVersion":1,"taskId":null,"toolchainSha256":"e1115c5484a8df29fd25f2a96ee77de8f5561088a869b4192b5cc8f791f4afa8"}},"eventHash":"5855b3890fc1d56fa82ba9d9275b6d8c7bc6af7a6e01de0686c28eedba7b07fb"},{"sequence":2,"timestampUtc":"2026-08-23T17:38:22.1726551\u002B00:00","type":"asset.generation.completed","previousEventHash":"5855b3890fc1d56fa82ba9d9275b6d8c7bc6af7a6e01de0686c28eedba7b07fb","payload":{"actorId":"codex-imagegen-service","assetId":"MKT-RIFTWARD-RESEARCH-HERO-001","generationBindingMode":"canonical-event-v1","generator":{"executionMode":"remote","generatorSourceSha256":null,"kind":"ai","model":"OpenAI built-in image generation","modelArtifactSha256":null,"modelVersion":"not-exposed-by-tool","seed":null,"tool":"Codex built-in image_gen","toolchainPin":null,"version":"2026-08-23-service-contract"},"inputs":[{"allowedUse":"internal-specification","creativeInfluence":true,"id":"SPEC-MKT-RIFTWARD-RESEARCH-HERO-001","license":"Project-private; no public content license asserted","origin":"Project-authored clean-room communication specification","originClass":"internal-specification","path":"assets/specs/marketing/MKT-RIFTWARD-RESEARCH-HERO-001.md","referenceUseReviewed":true,"rightsEvidence":"Derived only from the repository\u0027s own project, art, atmosphere, performance and communication requirements; no external media input was supplied.","sha256":"50ce178f6d61f4dc5fad0ac89dd81936802313428e05e77aa338c3a53013682f"}],"outputs":[{"bytes":2696357,"mediaType":"image/png","path":"assets/quarantine/marketing/MKT-RIFTWARD-RESEARCH-HERO-001.png","sha256":"b99d3f9bba0867cdb59946e980755092abf79c777104bfc6d7c5e42560deee86","technicalMetrics":{"alpha":false,"channels":3,"height":941,"width":1672}}],"promptBindingMode":"canonical-envelope-v1","promptEnvelopeSha256":"15879f7eddf6dd96a2774f8d5ce5a79d680cf22a51486225890e205ce1ed4eac","promptSha256":"3afd91dcbb9438a4aaa954ed3f414322eaa9bee8e1ffc1ff4239db96fa524223","purpose":"Original research and campaign hero concept; quarantine only.","specPath":"assets/specs/marketing/MKT-RIFTWARD-RESEARCH-HERO-001.md","specSha256":"50ce178f6d61f4dc5fad0ac89dd81936802313428e05e77aa338c3a53013682f","status":"quarantine","transformations":[]},"eventHash":"16bfd75e0b2fd2e3a3e277fdc67e0e695292312ad7984559955c830b779a34a7"},{"sequence":3,"timestampUtc":"2026-08-23T17:38:22.4488076\u002B00:00","type":"run.finished","previousEventHash":"16bfd75e0b2fd2e3a3e277fdc67e0e695292312ad7984559955c830b779a34a7","payload":{"actorId":"codex-imagegen-service","finalRetrievalTraceHash":null,"retrievalTraceCount":0,"status":"succeeded","summary":{"actorId":"codex-imagegen-service","assetId":"MKT-RIFTWARD-RESEARCH-HERO-001","manifestPath":"assets/manifests/MKT-RIFTWARD-RESEARCH-HERO-001.json","outcome":"Original research and campaign hero generated and technically inspected in quarantine.","remainingRisks":["The generator does not expose its exact model artifact, version, or seed.","Independent originality and license reviews remain open.","The image is concept communication and is not evidence of implemented gameplay."],"status":"quarantine"}},"eventHash":"f1675393e624e8d15ff440699832cfc05abe222e6485e9ebb300ba2dcd7c529a"}],
  "generationEvent": {"sequence":2,"eventHash":"16bfd75e0b2fd2e3a3e277fdc67e0e695292312ad7984559955c830b779a34a7","payloadSha256":"65c8e4f212f73f4ef6734668815ddea1c88d2bb942f50f84d060fcff94279de6"},
  "finalEventHash": "f1675393e624e8d15ff440699832cfc05abe222e6485e9ebb300ba2dcd7c529a",
  "retrievalTraceCount": 0,
  "finalRetrievalTraceHash": null,
  "summary": {"actorId":"codex-imagegen-service","assetId":"MKT-RIFTWARD-RESEARCH-HERO-001","manifestPath":"assets/manifests/MKT-RIFTWARD-RESEARCH-HERO-001.json","outcome":"Original research and campaign hero generated and technically inspected in quarantine.","remainingRisks":["The generator does not expose its exact model artifact, version, or seed.","Independent originality and license reviews remain open.","The image is concept communication and is not evidence of implemented gameplay."],"status":"quarantine"},
  "summaryHash": "74a8da710152d3a474ea7d0b38234b3af1c93f8e1117f0b7f7d3ab4082bd5f97",
  "spec": {"path":"assets/specs/marketing/MKT-RIFTWARD-RESEARCH-HERO-001.md","sha256":"50ce178f6d61f4dc5fad0ac89dd81936802313428e05e77aa338c3a53013682f"},
  "generator": {"executionMode":"remote","generatorSourceSha256":null,"kind":"ai","model":"OpenAI built-in image generation","modelArtifactSha256":null,"modelVersion":"not-exposed-by-tool","seed":null,"tool":"Codex built-in image_gen","toolchainPin":null,"version":"2026-08-23-service-contract"},
  "inputs": [{"allowedUse":"internal-specification","creativeInfluence":true,"id":"SPEC-MKT-RIFTWARD-RESEARCH-HERO-001","license":"Project-private; no public content license asserted","origin":"Project-authored clean-room communication specification","originClass":"internal-specification","path":"assets/specs/marketing/MKT-RIFTWARD-RESEARCH-HERO-001.md","referenceUseReviewed":true,"rightsEvidence":"Derived only from the repository\u0027s own project, art, atmosphere, performance and communication requirements; no external media input was supplied.","sha256":"50ce178f6d61f4dc5fad0ac89dd81936802313428e05e77aa338c3a53013682f"}],
  "prompts": {"bindingMode":"canonical-envelope-v1","negativePrompt":null,"prompt":"Use case: marketing campaign hero and research-project visualization\nAsset type: completely original wide cinematic key art for an experimental cross-platform fantasy RTS/RPG production, without any typography\nPrimary request: show one continuous wounded valley changing from intimate exploration on the left, through cooperative rebuilding in the center, into a readable defensive strategy situation on the right; three mortal field engineers follow a rain-darkened stone causeway toward an inhabited terraced quarry refuge where workers repair timber bridges, gardens and water channels, while farther right organized small formations protect civilians by opening a practical wooden sluice that redirects shallow water across one approach\nNarrative idea: human-scale understanding grows into responsibility for a community and landscape; the same places, people and material systems connect all three scales rather than forming separate panels\nWorld detail: sparse wind-bent pines and alder, weathered local stone, patched canvas, practical tools, warm workshops, a distant mismatched masonry survey tower, and a subtle geological anomaly visible only as a restrained amber mineral seam with one physically impossible shadow edge\nStyle/medium: polished stylized-realistic original 3D game concept art with painterly color grading, believable PBR-like materials, deliberately simplified production-feasible geometry, strong silhouettes and terrain readability suitable for a low-spec real-time game target\nComposition/framing: panoramic 16:9 elevated three-quarter game camera, continuous landscape with visual flow from left foreground to warm center and right background; no triptych borders; the three scales must remain distinguishable at thumbnail size; reserve some calm dark sky and terrain space for optional external text overlay, but render no text in the image\nLighting/mood: wistful, earthy, wondrous and determined; blue-hour after rain, one dominant low sky direction, baked-light feeling, restrained warm inhabited islands, localized haze only\nColor palette: about 60 percent muted earth and blue-gray stone, 30 percent desaturated forest and storm blue, 10 percent warm amber work light and anomaly accent\nConstraints: entirely original clean-room world and design; no text, letters, logo, interface, watermark or mock UI; no giant hero portrait, no ornate palace, no giant monster, no neon portal, no ray-traced spectacle, no dense particle veil, no photobash artifacts; no recognizable borrowed imagery, characters, architecture, maps, symbols, faction emblems or style imitation of any named artist or existing game","promptEnvelopeSha256":"15879f7eddf6dd96a2774f8d5ce5a79d680cf22a51486225890e205ce1ed4eac","promptSha256":"3afd91dcbb9438a4aaa954ed3f414322eaa9bee8e1ffc1ff4239db96fa524223"},
  "transformations": [],
  "outputs": [{"bytes":2696357,"mediaType":"image/png","path":"assets/quarantine/marketing/MKT-RIFTWARD-RESEARCH-HERO-001.png","sha256":"b99d3f9bba0867cdb59946e980755092abf79c777104bfc6d7c5e42560deee86","technicalMetrics":{"alpha":false,"channels":3,"height":941,"width":1672}}],
  "receiptSha256": "645253581e16c81e2f88f365fff5c75aa11c0657104019c77d3cfd95d0f6fc97"
}