{
  "$schema": "../../.ai/schemas/generation-receipt.schema.json",
  "schemaVersion": 1,
  "runId": "01KZXQ64PKK15YX939FB9HQWXN",
  "status": "succeeded",
  "startedAtUtc": "2026-08-13T14:07:30.5157566\u002B00:00",
  "finishedAtUtc": "2026-08-13T14:09:49.4191998\u002B00:00",
  "actorId": "codex-imagegen-service",
  "assetId": "ENV-SLUICE-DEFENSE-KEYFRAME-003",
  "generationBindingMode": "legacy-event-v0",
  "eventCount": 2,
  "events": [{"sequence":1,"timestampUtc":"2026-08-13T14:09:48.5056880\u002B00:00","type":"asset.generation.completed","previousEventHash":null,"payload":{"actorId":"codex-imagegen-service","assetId":"ENV-SLUICE-DEFENSE-KEYFRAME-003","generator":{"executionMode":"remote","inputImages":0,"modelVersion":"not-exposed-by-tool","tool":"Codex built-in image_gen"},"outputBytes":2432833,"outputPath":"assets/quarantine/concepts/ENV-SLUICE-DEFENSE-KEYFRAME-003.png","outputSha256":"362b21f8752cbb231e5fedfe2882aaa5665d4ecbfc69f65448f7b1ff9c5a6c76","promptSha256":"7e1c9d9dcb9fc784dc9b34cfd351ccef214ea64b8cff3859cdf990dfa7b3a9d5","purpose":"Original strategy-defense art-bible calibration keyframe; quarantine only.","specPath":"assets/specs/ENV-SLUICE-DEFENSE-KEYFRAME-003.md","specSha256":"130551f20f7fe970fb3e137619e270a31d4317cbedbdabc76742392b3880ddb7","status":"quarantine"},"eventHash":"a58649af72869990fcf7aedb361c401ff1a19a17e4429bab0ff69dc02aef9be0"},{"sequence":2,"timestampUtc":"2026-08-13T14:09:49.4191998\u002B00:00","type":"run.finished","previousEventHash":"a58649af72869990fcf7aedb361c401ff1a19a17e4429bab0ff69dc02aef9be0","payload":{"status":"succeeded","summary":{"actorId":"codex-imagegen-service","assetId":"ENV-SLUICE-DEFENSE-KEYFRAME-003","manifestPath":"assets/manifests/ENV-SLUICE-DEFENSE-KEYFRAME-003.json","outcome":"Original strategy-defense keyframe generated and technically validated in ignored quarantine.","remainingRisks":["Generator model identity and output terms are not exposed by the built-in tool.","Independent originality and license reviews remain open.","T-003 executable provenance gate is not implemented."],"status":"quarantine"}},"eventHash":"2b8a8b0e92ad019937a1f550b17c706b2170430952a514062eec2be118b7fa65"}],
  "generationEvent": {"sequence":1,"eventHash":"a58649af72869990fcf7aedb361c401ff1a19a17e4429bab0ff69dc02aef9be0","payloadSha256":"067f4acc158cf6625d9f2b048e8f337cd2b30d8713bcf2c3b949453bf0f97af4"},
  "finalEventHash": "2b8a8b0e92ad019937a1f550b17c706b2170430952a514062eec2be118b7fa65",
  "summary": {"actorId":"codex-imagegen-service","assetId":"ENV-SLUICE-DEFENSE-KEYFRAME-003","manifestPath":"assets/manifests/ENV-SLUICE-DEFENSE-KEYFRAME-003.json","outcome":"Original strategy-defense keyframe generated and technically validated in ignored quarantine.","remainingRisks":["Generator model identity and output terms are not exposed by the built-in tool.","Independent originality and license reviews remain open.","T-003 executable provenance gate is not implemented."],"status":"quarantine"},
  "summaryHash": "31973008758b438ea86dcf2f9b4fd91ec45bedddcc2e295a70159454f0d079fb",
  "spec": {"path":"assets/specs/ENV-SLUICE-DEFENSE-KEYFRAME-003.md","sha256":"130551f20f7fe970fb3e137619e270a31d4317cbedbdabc76742392b3880ddb7"},
  "generator": {"executionMode":"remote","generatorSourceSha256":null,"kind":"ai","model":"OpenAI built-in image generation","modelArtifactSha256":null,"modelVersion":"not-exposed-by-tool","seed":null,"tool":"Codex built-in image_gen","toolchainPin":null,"version":"2026-08-13-service-contract"},
  "inputs": [{"allowedUse":"internal-specification","creativeInfluence":true,"id":"SPEC-ENV-SLUICE-DEFENSE-KEYFRAME-003","license":"Project-private; no public license asserted","origin":"Project-authored clean-room specification","originClass":"internal-specification","path":"assets/specs/ENV-SLUICE-DEFENSE-KEYFRAME-003.md","referenceUseReviewed":true,"rightsEvidence":"Created from the repository\u0027s internal art, game-design and atmosphere requirements without external media inputs.","sha256":"130551f20f7fe970fb3e137619e270a31d4317cbedbdabc76742392b3880ddb7"}],
  "prompts": {"bindingMode":"legacy-prompt-only","negativePrompt":null,"prompt":"Use case: stylized-concept\nAsset type: original art-bible calibration keyframe for the strategy-defense phase of a cross-platform fantasy RTS/RPG\nPrimary request: create a completely original wide game-environment keyframe of a working refuge defending its terraced waterworks at stormy dusk; a small field-engineer party has opened a timber sluice that redirects a shallow torrent across one approach while organized local shield lines and polearm groups hold two dry lanes; workers carry supplies and guide civilians toward warm shelter rather than disappearing from the battlefield context\nScene/backdrop: inhabited quarry basin with low practical workshops, gardens, water channels, repaired bridges and a modest palisade; three readable approach lanes, one temporarily flooded by the sluice; dark hills and rain front beyond\nSubject: the combined tactical landscape is primary; approximately forty small human-scale defenders and attackers appear in clearly separated groups, with the three-person engineer party identifiable by position and restrained amber task lights rather than oversized bodies\nStyle/medium: polished stylized-realistic 3D game concept art with painterly color grading, believable but deliberately simplified materials, large production-feasible forms and clean unit silhouettes\nComposition/framing: wide elevated three-quarter strategy camera close to intended gameplay; central defended basin, visible lane geometry and formation spacing; no cinematic close-up and no horizon-dominating creature\nLighting/mood: pressured but determined, earthy and bittersweet rather than triumphant spectacle; cool storm ambient light, warm shelter and work lights, short readable steel and dust accents, restrained amber water-control signal\nColor palette: muted wet earth, dark timber and blue-gray stone; limited warm inhabited light; one functional amber interaction accent and subdued desaturated unit cloth colors\nMaterials/textures: rain-darkened masonry, rough timber engineering, packed mud, canvas, shallow turbulent water, worn metal and practical cloth\nConstraints: entirely original world and design; units, formations, paths and the terrain lever must remain readable at 1080p; no text, logo, interface or watermark; no giant magical explosion, no glowing faction carpet, no ornate superweapons, no dense particle veil, no photobash artifacts; no recognizable borrowed imagery, iconic pre-existing characters, copied architecture, copied maps or familiar emblems","promptEnvelopeSha256":"f06bd8d6a1586a85aea464d45f81d5ab4da2c588dbbca07250bb57f87da9baa0","promptSha256":"7e1c9d9dcb9fc784dc9b34cfd351ccef214ea64b8cff3859cdf990dfa7b3a9d5"},
  "transformations": [],
  "outputs": [{"bytes":2432833,"mediaType":"image/png","path":"assets/quarantine/concepts/ENV-SLUICE-DEFENSE-KEYFRAME-003.png","sha256":"362b21f8752cbb231e5fedfe2882aaa5665d4ecbfc69f65448f7b1ff9c5a6c76","technicalMetrics":{"alpha":false,"channels":3,"height":941,"width":1672}}],
  "receiptSha256": "1326b538d02f35873e24ae4ceeebd6e7f9d6866086f461f9c434c5c09972e273"
}