{
  "$schema": "../../.ai/schemas/generation-receipt.schema.json",
  "schemaVersion": 1,
  "runId": "01KZXQ0YTWFWP8MQAKG2560PE1",
  "status": "succeeded",
  "startedAtUtc": "2026-08-13T14:04:40.6686115\u002B00:00",
  "finishedAtUtc": "2026-08-13T14:06:56.3831060\u002B00:00",
  "actorId": "codex-imagegen-service",
  "assetId": "ENV-QUARRY-REFUGE-KEYFRAME-001",
  "generationBindingMode": "legacy-event-v0",
  "eventCount": 2,
  "events": [{"sequence":1,"timestampUtc":"2026-08-13T14:06:55.4396154\u002B00:00","type":"asset.generation.completed","previousEventHash":null,"payload":{"actorId":"codex-imagegen-service","assetId":"ENV-QUARRY-REFUGE-KEYFRAME-001","generator":{"executionMode":"remote","inputImages":0,"modelVersion":"not-exposed-by-tool","tool":"Codex built-in image_gen"},"outputBytes":2846895,"outputPath":"assets/quarantine/concepts/ENV-QUARRY-REFUGE-KEYFRAME-001-v2.png","outputSha256":"2d4b805e338ea799c52611662dca5edcadd13fb01d2514967b1a8c5b0c801e1a","promptSha256":"5533bd30da25fef7b2c1bf8dca15b1f13dd33a4b5388df62d6f85e678f7fead4","purpose":"Original strategy-camera art-bible calibration keyframe; quarantine only.","specPath":"assets/specs/ENV-QUARRY-REFUGE-KEYFRAME-001.md","specSha256":"134e3a3e60c9be3de3ac842eab5682571d4274f783705702a484444e07d0f100","status":"quarantine"},"eventHash":"3bfbd3a99a1d315caceb85f059091d881a28806e0858e44a162a82cfc4928196"},{"sequence":2,"timestampUtc":"2026-08-13T14:06:56.3831060\u002B00:00","type":"run.finished","previousEventHash":"3bfbd3a99a1d315caceb85f059091d881a28806e0858e44a162a82cfc4928196","payload":{"status":"succeeded","summary":{"actorId":"codex-imagegen-service","assetId":"ENV-QUARRY-REFUGE-KEYFRAME-001","manifestPath":"assets/manifests/ENV-QUARRY-REFUGE-KEYFRAME-001.json","outcome":"Original strategy-camera keyframe regenerated from the current clean-room prompt and technically validated in quarantine.","remainingRisks":["Generator model identity and output terms are not exposed by the built-in tool.","Independent originality and license reviews remain open.","The earlier local output is unreferenced and remains ignored quarantine material."],"status":"quarantine"}},"eventHash":"565eeb91eaec0f7ff2ec3aaa912fdd4cd2bd2bc88775e0c156360bd99d455f7f"}],
  "generationEvent": {"sequence":1,"eventHash":"3bfbd3a99a1d315caceb85f059091d881a28806e0858e44a162a82cfc4928196","payloadSha256":"7e459fd4a3ebedfd8c4b8ffafd30dd15967e0bb891d7332109664d9991b3d5e7"},
  "finalEventHash": "565eeb91eaec0f7ff2ec3aaa912fdd4cd2bd2bc88775e0c156360bd99d455f7f",
  "summary": {"actorId":"codex-imagegen-service","assetId":"ENV-QUARRY-REFUGE-KEYFRAME-001","manifestPath":"assets/manifests/ENV-QUARRY-REFUGE-KEYFRAME-001.json","outcome":"Original strategy-camera keyframe regenerated from the current clean-room prompt and technically validated in quarantine.","remainingRisks":["Generator model identity and output terms are not exposed by the built-in tool.","Independent originality and license reviews remain open.","The earlier local output is unreferenced and remains ignored quarantine material."],"status":"quarantine"},
  "summaryHash": "5929041509a22ec733c9f72ec44514037f2e3609526e96dc464032876744222c",
  "spec": {"path":"assets/specs/ENV-QUARRY-REFUGE-KEYFRAME-001.md","sha256":"134e3a3e60c9be3de3ac842eab5682571d4274f783705702a484444e07d0f100"},
  "generator": {"executionMode":"remote","generatorSourceSha256":null,"kind":"ai","model":"OpenAI built-in image generation","modelArtifactSha256":null,"modelVersion":"not-exposed-by-tool","seed":null,"tool":"Codex built-in image_gen","toolchainPin":null,"version":"2026-08-13-service-contract"},
  "inputs": [{"allowedUse":"internal-specification","creativeInfluence":true,"id":"SPEC-ENV-QUARRY-REFUGE-KEYFRAME-001","license":"Project-private; no public license asserted","origin":"Project-authored clean-room specification","originClass":"internal-specification","path":"assets/specs/ENV-QUARRY-REFUGE-KEYFRAME-001.md","referenceUseReviewed":true,"rightsEvidence":"Created from the repository\u0027s internal art and atmosphere requirements without external media inputs.","sha256":"134e3a3e60c9be3de3ac842eab5682571d4274f783705702a484444e07d0f100"}],
  "prompts": {"bindingMode":"legacy-prompt-only","negativePrompt":null,"prompt":"Use case: stylized-concept\nAsset type: original art-bible calibration keyframe for a cross-platform fantasy RTS/RPG, viewed from the playable strategy camera\nPrimary request: create a completely original game-environment keyframe showing a weary field engineer and two companions arriving at a small inhabited refuge built into an ancient terraced stone quarry at blue-hour dusk; workers repair rope bridges and timber retaining walls while a subtle geological anomaly bends one distant shadow and reveals a thin amber mineral seam; the place feels lived-in, vulnerable, useful, and worth protecting\nScene/backdrop: broad readable valley bowl, weathered stone terraces, sparse wind-bent pines, practical gardens, water channel, repair yard, one distant landmark tower made from mismatched local masonry; two visible exploration paths and a defensible central basin\nSubject: human-scale refuge and landscape are primary; three small traveler silhouettes provide scale, not character-design detail\nStyle/medium: polished stylized-realistic 3D game concept art with painterly color grading, believable PBR-like stone, timber, cloth and earth, deliberately simplified large forms, production-feasible geometry\nComposition/framing: wide elevated three-quarter isometric strategy-game camera, landscape navigation and silhouettes immediately readable at 1080p, calm foreground approach leading toward warm inhabited center, distant landmark visible\nLighting/mood: wistful, earthy, wondrous, determined; cool desaturated blue-gray wilderness contrasted with restrained warm window and forge islands; one dominant low sun/sky direction, baked-light feeling, light localized haze only\nColor palette: roughly 60 percent muted earth and stone, 30 percent cool pine and dusk blue, 10 percent amber anomaly and inhabited warmth\nMaterials/textures: worn local stone, repaired timber, patched canvas, packed soil, moss used sparingly; visible signs of labor and maintenance\nConstraints: entirely original world and design; strong RTS readability; no text, no logo, no interface, no watermark; no ornate heroic palace, no giant character close-up, no neon magic fog, no ray-traced spectacle, no photobash artifacts; no recognizable borrowed imagery, iconic pre-existing characters, copied architecture, copied maps, or familiar emblems","promptEnvelopeSha256":"e2fca68ba7e75dbc48f3ee14df0e98d13c04f3eed162863be60c00c77875be46","promptSha256":"5533bd30da25fef7b2c1bf8dca15b1f13dd33a4b5388df62d6f85e678f7fead4"},
  "transformations": [],
  "outputs": [{"bytes":2846895,"mediaType":"image/png","path":"assets/quarantine/concepts/ENV-QUARRY-REFUGE-KEYFRAME-001-v2.png","sha256":"2d4b805e338ea799c52611662dca5edcadd13fb01d2514967b1a8c5b0c801e1a","technicalMetrics":{"alpha":false,"channels":3,"height":1024,"width":1536}}],
  "receiptSha256": "eb0e60cc11061154588cb513f61442f4d4e8932ab7266e52cba3c11526e5faff"
}