{
  "$schema": "../../.ai/schemas/generation-receipt.schema.json",
  "schemaVersion": 1,
  "runId": "01KZXPTT9WR4PHQQSS2NNT16XY",
  "status": "succeeded",
  "startedAtUtc": "2026-08-13T14:01:19.4200541\u002B00:00",
  "finishedAtUtc": "2026-08-13T14:04:16.8638624\u002B00:00",
  "actorId": "codex-imagegen-service",
  "assetId": "ENV-FLOODED-CAUSEWAY-KEYFRAME-002",
  "generationBindingMode": "legacy-event-v0",
  "eventCount": 2,
  "events": [{"sequence":1,"timestampUtc":"2026-08-13T14:04:15.9865100\u002B00:00","type":"asset.generation.completed","previousEventHash":null,"payload":{"actorId":"codex-imagegen-service","assetId":"ENV-FLOODED-CAUSEWAY-KEYFRAME-002","generator":{"executionMode":"remote","inputImages":0,"modelVersion":"not-exposed-by-tool","tool":"Codex built-in image_gen"},"outputBytes":3130161,"outputPath":"assets/quarantine/concepts/ENV-FLOODED-CAUSEWAY-KEYFRAME-002.png","outputSha256":"9002b81ddf65a8d3c5804b7fd4f1de751a22752e36ad2848e5642f27b006c201","promptSha256":"e11ec813aa2ffb23aa222797eba2c77a4b116af9adce93538d3a38b865bd1a48","purpose":"Original quiet-exploration art-bible calibration keyframe; quarantine only.","specPath":"assets/specs/ENV-FLOODED-CAUSEWAY-KEYFRAME-002.md","specSha256":"5afd25b4fc0e0fb065ca9c3f10638ec6a5db2dad36cb8e6a5c21d6979fafd910","status":"quarantine"},"eventHash":"2e1dd7b505c04e23462d47dce7739e38b14e4052251aacff0e4e13794ae9b707"},{"sequence":2,"timestampUtc":"2026-08-13T14:04:16.8638624\u002B00:00","type":"run.finished","previousEventHash":"2e1dd7b505c04e23462d47dce7739e38b14e4052251aacff0e4e13794ae9b707","payload":{"status":"succeeded","summary":{"actorId":"codex-imagegen-service","assetId":"ENV-FLOODED-CAUSEWAY-KEYFRAME-002","manifestPath":"assets/manifests/ENV-FLOODED-CAUSEWAY-KEYFRAME-002.json","outcome":"Original quiet-exploration keyframe generated and technically validated in ignored quarantine.","remainingRisks":["Visual review is needs-work because the output contains four prominent stones instead of three.","Generator model identity and output terms are not exposed by the built-in tool.","Independent originality and license reviews remain open."],"status":"quarantine"}},"eventHash":"d7d208d50799217a593e58a705b7685b9c8431e350ce3db2064efd1dcc21d236"}],
  "generationEvent": {"sequence":1,"eventHash":"2e1dd7b505c04e23462d47dce7739e38b14e4052251aacff0e4e13794ae9b707","payloadSha256":"ad2f9993348ef6d1747c5d9aa37b0256ed7ba72a1d2586a507a80a3e2b9fec56"},
  "finalEventHash": "d7d208d50799217a593e58a705b7685b9c8431e350ce3db2064efd1dcc21d236",
  "summary": {"actorId":"codex-imagegen-service","assetId":"ENV-FLOODED-CAUSEWAY-KEYFRAME-002","manifestPath":"assets/manifests/ENV-FLOODED-CAUSEWAY-KEYFRAME-002.json","outcome":"Original quiet-exploration keyframe generated and technically validated in ignored quarantine.","remainingRisks":["Visual review is needs-work because the output contains four prominent stones instead of three.","Generator model identity and output terms are not exposed by the built-in tool.","Independent originality and license reviews remain open."],"status":"quarantine"},
  "summaryHash": "ecc80fa4c2cd6367b81bbd35d1041edd4136da5b4acb971cc1433088b5a39ec9",
  "spec": {"path":"assets/specs/ENV-FLOODED-CAUSEWAY-KEYFRAME-002.md","sha256":"5afd25b4fc0e0fb065ca9c3f10638ec6a5db2dad36cb8e6a5c21d6979fafd910"},
  "generator": {"executionMode":"remote","generatorSourceSha256":null,"kind":"ai","model":"OpenAI built-in image generation","modelArtifactSha256":null,"modelVersion":"not-exposed-by-tool","seed":null,"tool":"Codex built-in image_gen","toolchainPin":null,"version":"2026-08-13-service-contract"},
  "inputs": [{"allowedUse":"internal-specification","creativeInfluence":true,"id":"SPEC-ENV-FLOODED-CAUSEWAY-KEYFRAME-002","license":"Project-private; no public license asserted","origin":"Project-authored clean-room specification","originClass":"internal-specification","path":"assets/specs/ENV-FLOODED-CAUSEWAY-KEYFRAME-002.md","referenceUseReviewed":true,"rightsEvidence":"Created from the repository\u0027s internal art and atmosphere requirements without external media inputs.","sha256":"5afd25b4fc0e0fb065ca9c3f10638ec6a5db2dad36cb8e6a5c21d6979fafd910"}],
  "prompts": {"bindingMode":"legacy-prompt-only","negativePrompt":null,"prompt":"Use case: stylized-concept\nAsset type: original art-bible calibration keyframe for the quiet exploration phase of a cross-platform fantasy RTS/RPG\nPrimary request: create a completely original game-environment keyframe in which a mortal field engineer and two practical companions pause on a flooded old causeway to study a strange natural resonance; shallow water trembles in concentric lines around three fractured standing stones while abandoned repair tools, a tied empty ferry and fresh boot tracks imply that local workers disappeared only recently\nScene/backdrop: narrow valley wetland after rain, half-sunken masonry causeway, wind-bent alder trees, reed beds, distant inhabited smoke beyond a low ridge, one fork toward a dry overlook and one route through ankle-deep water\nSubject: the small traveling group and the environmental clue share focus; no heroic posing and no oversized monster\nStyle/medium: polished stylized-realistic 3D game concept art with painterly color grading, believable but simplified stone, wet timber, cloth, leather, water and vegetation, production-feasible forms\nComposition/framing: elevated three-quarter playable-camera view, closer than the strategy view but still clearly navigable; readable path fork, silhouettes separated from terrain, environmental clues legible without text\nLighting/mood: wistful, earthy, wondrous and quietly determined; overcast cool daylight breaking into one restrained warm shaft near the far inhabited smoke; localized silver-blue resonance with no neon fog\nColor palette: muted peat brown, wet gray stone and desaturated green; small warm ochre on tools and clothing; very limited silver-blue anomaly accent\nMaterials/textures: rain-darkened stone, repaired rope, worn field equipment, rippled shallow water, sparse reeds, mud tracks and chipped hand-built masonry\nConstraints: entirely original world and design; no text, no logo, no interface, no watermark; no glamorous portrait, no elaborate royal armor, no giant glowing portal, no excessive particles, no photobash artifacts; no recognizable borrowed imagery, iconic pre-existing characters, copied architecture, copied maps or familiar emblems","promptEnvelopeSha256":"4ddb9712048d508bbbb40df33ba6d207f19af54b33a557eecd5125b1e9db768d","promptSha256":"e11ec813aa2ffb23aa222797eba2c77a4b116af9adce93538d3a38b865bd1a48"},
  "transformations": [],
  "outputs": [{"bytes":3130161,"mediaType":"image/png","path":"assets/quarantine/concepts/ENV-FLOODED-CAUSEWAY-KEYFRAME-002.png","sha256":"9002b81ddf65a8d3c5804b7fd4f1de751a22752e36ad2848e5642f27b006c201","technicalMetrics":{"alpha":false,"channels":3,"height":1024,"width":1536}}],
  "receiptSha256": "c34470f9aea9a18c789d9ae89d650b44d7057b48995302c631476db2f98105c7"
}